{
  "adapter_id": "CHATGPT_EXTERNAL_HANDOFF",
  "author_permission": "admin",
  "authority": "EXTERNAL_CHAT_HANDOFF_ONLY",
  "authorization_digest": "aaaaaaaaaaaaaaaaaaaaaaaaaaaaaaaaaaaaaaaaaaaaaaaaaaaaaaaaaaaaaaaa",
  "authorization_id": "handoff-auth-example",
  "branch": "feat/example-one",
  "change_risk": "MEDIUM",
  "effect_id": "handoff-effect-example",
  "handoff_digest": "a221416102f9a776748d691a4733fff0a23542b415108f50116babf982f83139",
  "head": "1111111111111111111111111111111111111111",
  "implementer": "CHATGPT_CHAT",
  "intent_revision": 2,
  "issue_number": 201,
  "kind": "concurrency_work_packet_handoff_authorization",
  "node_id": "datarelay-labs/datarelay-atlas#201",
  "pass_authority": "NONE",
  "provider": "openai",
  "release_authority": "NONE",
  "replay_key": "b95131e4293293d3f7acf5bf81c2406d8d36ed68bfa77b136ee97fe3ec854302",
  "repository": "datarelay-labs/datarelay-atlas",
  "route_id": "chat-primary",
  "runtime": "chat_ssh",
  "schema_version": 1,
  "slot_evidence_ref": "capacity:chat-worker-1:001",
  "slot_id": "slot-chat-1",
  "spawned": false,
  "worker_id": "chat-worker-1",
  "workstream": "concurrency-node-1",
  "worktree_identity_digest": "bbbbbbbbbbbbbbbbbbbbbbbbbbbbbbbbbbbbbbbbbbbbbbbbbbbbbbbbbbbbbbbb",
  "worktree_path": "/srv/datarelay-atlas-worktrees/example-one"
}
